{
  "$schema": "https://json-schema.org/draft/2020-12/schema",
  "type": "object",
  "properties": {
    "@context": {
      "type": "string",
      "minLength": 1
    },
    "@type": {
      "type": "string",
      "minLength": 1
    },
    "@id": {
      "type": "string",
      "format": "uri"
    },
    "name": {
      "type": "string",
      "minLength": 1
    },
    "hasPart": {
      "type": "array",
      "items": {
        "type": "object",
        "properties": {
          "@id": {
            "type": "string",
            "format": "uri"
          },
          "@type": {
            "type": "string",
            "minLength": 1
          },
          "name": {
            "type": "string",
            "minLength": 1
          }
        },
        "required": [
          "@id",
          "@type"
        ],
        "additionalProperties": false
      }
    },
    "about": {
      "type": "array",
      "items": {
        "type": "object",
        "properties": {
          "@id": {
            "type": "string",
            "format": "uri"
          },
          "@type": {
            "type": "string",
            "const": "CollectionPage"
          },
          "name": {
            "type": "string",
            "minLength": 1
          }
        },
        "required": [
          "@id",
          "@type"
        ],
        "additionalProperties": false
      }
    },
    "value": {
      "anyOf": [
        {
          "type": "string"
        },
        {
          "type": "number"
        },
        {
          "type": "boolean"
        }
      ]
    },
    "version": {
      "type": "string",
      "minLength": 1
    }
  },
  "required": [
    "@context",
    "@type",
    "@id",
    "name",
    "hasPart",
    "about"
  ],
  "additionalProperties": false,
  "$id": "https://kmturley.github.io/static-api-json-schema/schema/collection"
}