{
  "@context": "https://schema.org",
  "@type": "CollectionPage",
  "@id": "https://kmturley.github.io/static-api-json-schema/games/search",
  "name": "games search",
  "about": [
    {
      "@id": "https://kmturley.github.io/static-api-json-schema/games",
      "@type": "CollectionPage",
      "name": "games collection"
    }
  ],
  "hasPart": [
    {
      "@id": "https://kmturley.github.io/static-api-json-schema/games/search/genre",
      "@type": "CollectionPage",
      "name": "genre"
    },
    {
      "@id": "https://kmturley.github.io/static-api-json-schema/games/search/tags",
      "@type": "CollectionPage",
      "name": "tags"
    }
  ]
}