{
  "@context": "https://schema.org",
  "@type": "CollectionPage",
  "@id": "https://kmturley.github.io/static-api-json-schema/games/search/genre",
  "name": "games search by genre",
  "about": [
    {
      "@id": "https://kmturley.github.io/static-api-json-schema/games",
      "@type": "CollectionPage",
      "name": "games collection"
    }
  ],
  "hasPart": [
    {
      "@id": "https://kmturley.github.io/static-api-json-schema/games/search/genre/puzzle",
      "@type": "CollectionPage",
      "name": "Puzzle"
    },
    {
      "@id": "https://kmturley.github.io/static-api-json-schema/games/search/genre/adventure",
      "@type": "CollectionPage",
      "name": "Adventure"
    }
  ]
}