{
  "@context": "https://schema.org",
  "@type": "CollectionPage",
  "@id": "https://kmturley.github.io/static-api-json-schema/games/search/tags/puzzle",
  "name": "games tags puzzle",
  "about": [
    {
      "@id": "https://kmturley.github.io/static-api-json-schema/games",
      "@type": "CollectionPage",
      "name": "games collection"
    }
  ],
  "value": "puzzle",
  "hasPart": [
    {
      "@id": "https://kmturley.github.io/static-api-json-schema/games/lumen",
      "@type": "SoftwareApplication",
      "name": "Lumen Drift"
    }
  ]
}