{
  "@context": "https://schema.org",
  "@type": "CollectionPage",
  "@id": "https://kmturley.github.io/static-api-json-schema/games/search/tags/platformer",
  "name": "games tags platformer",
  "about": [
    {
      "@id": "https://kmturley.github.io/static-api-json-schema/games",
      "@type": "CollectionPage",
      "name": "games collection"
    }
  ],
  "value": "platformer",
  "hasPart": [
    {
      "@id": "https://kmturley.github.io/static-api-json-schema/games/lumen-drift",
      "@type": "SoftwareApplication",
      "name": "Lumen Drift"
    }
  ]
}