{
  "@context": "https://schema.org",
  "@type": "CollectionPage",
  "@id": "https://kmturley.github.io/static-api-json-schema/publishers",
  "name": "publishers collection",
  "hasPart": [
    {
      "@id": "https://kmturley.github.io/static-api-json-schema/publishers/acme",
      "@type": "Organization",
      "name": "Acme Interactive"
    },
    {
      "@id": "https://kmturley.github.io/static-api-json-schema/publishers/lighthouse",
      "@type": "Organization",
      "name": "Lighthouse Studio"
    }
  ],
  "about": []
}