{
  "@context": "https://schema.org",
  "@type": "CollectionPage",
  "@id": "https://kmturley.github.io/static-api-json-schema/games/search/tags/sci-fi",
  "name": "games tags sci-fi",
  "about": [
    {
      "@id": "https://kmturley.github.io/static-api-json-schema/games",
      "@type": "CollectionPage",
      "name": "games collection"
    }
  ],
  "value": "sci-fi",
  "hasPart": [
    {
      "@id": "https://kmturley.github.io/static-api-json-schema/games/space-quest",
      "@type": "SoftwareApplication",
      "name": "Space Quest Prototype"
    }
  ]
}