{
  "@context": "https://schema.org",
  "@type": "CollectionPage",
  "@id": "https://kmturley.github.io/static-api-json-schema/games/search/tags",
  "name": "games search by tags",
  "about": [
    {
      "@id": "https://kmturley.github.io/static-api-json-schema/games",
      "@type": "CollectionPage",
      "name": "games collection"
    }
  ],
  "hasPart": [
    {
      "@id": "https://kmturley.github.io/static-api-json-schema/games/search/tags/puzzle",
      "@type": "CollectionPage",
      "name": "puzzle"
    },
    {
      "@id": "https://kmturley.github.io/static-api-json-schema/games/search/tags/platformer",
      "@type": "CollectionPage",
      "name": "platformer"
    },
    {
      "@id": "https://kmturley.github.io/static-api-json-schema/games/search/tags/sci-fi",
      "@type": "CollectionPage",
      "name": "sci-fi"
    },
    {
      "@id": "https://kmturley.github.io/static-api-json-schema/games/search/tags/single-player",
      "@type": "CollectionPage",
      "name": "single-player"
    }
  ]
}