{
  "@context": "https://schema.org",
  "@type": "CollectionPage",
  "@id": "https://example.com/games/search/genre/adventure",
  "name": "games genre Adventure",
  "about": [
    {
      "@id": "https://example.com/games",
      "@type": "CollectionPage",
      "name": "games collection"
    }
  ],
  "value": "Adventure",
  "hasPart": [
    {
      "@id": "https://example.com/games/space-quest",
      "@type": "SoftwareApplication",
      "name": "Space Quest Prototype"
    }
  ]
}